[
    {
        "_id": {
            "$oid": "69e9f659bbe8a7c42df70304"
        },
        "categoryId": {
            "$oid": "69e9f54f9ef154d26c17ef1a"
        },
        "categorySlug": "smartphones",
        "name": "Apple iPhone 17e",
        "slug": "apple-iphone-17e",
        "brand": "Apple",
        "model": "iPhone 17e",
        "country": "International",
        "price": 12952.53,
        "promotionalPrice": 12141.73,
        "currency": "MDL",
        "stock": 120,
        "imageUrls": [
            "static/assets/images/prod-images/smartphones/apple/apple-iphone-17e-1.png"
        ],
        "specs": {
            "screenSize": "6.1 inches, 1170x2532 pixels",
            "processor": "Apple A19 Hexa-core (2x4.26 GHz + 4x2.60 GHz)",
            "ram": "8 GB",
            "storage": "256GB / 512GB NVMe",
            "os": "iOS 26.3 (upgradable to 26.4)",
            "battery": "Li-Ion 4005 mAh, 15W wireless MagSafe/Qi2",
            "camera": "48 MP wide, OIS, 4K video",
            "gpu": "Apple GPU (4-core graphics)",
            "batteryLife": "15h30 active use, 45h endurance"
        },
        "isActive": true,
        "createdAt": {
            "$date": "2026-04-23T19:50:00Z"
        },
        "updatedAt": {
            "$date": "2026-04-23T19:50:00Z"
        }
    },
    {
        "_id": {
            "$oid": "69e9f659bbe8a7c42df70305"
        },
        "categoryId": {
            "$oid": "69e9f54f9ef154d26c17ef1a"
        },
        "categorySlug": "smartphones",
        "name": "Apple iPhone 17 Pro Max",
        "slug": "apple-iphone-17-pro-max",
        "brand": "Apple",
        "model": "iPhone 17 Pro Max",
        "country": "International",
        "price": 27040.18,
        "promotionalPrice": 22074.03,
        "currency": "MDL",
        "stock": 200,
        "imageUrls": [
            "static/assets/images/prod-images/smartphones/apple/apple-iphone-17-pro-max-1.png"
        ],
        "specs": {
            "screenSize": "6.9 inches, 1320x2868 pixels, 120Hz",
            "processor": "Apple A19 Pro Hexa-core (2x4.26 GHz + 4x2.60 GHz)",
            "ram": "12 GB",
            "storage": "256GB / 512GB / 1TB / 2TB NVMe",
            "os": "iOS 26 (upgradable to 26.4)",
            "battery": "Li-Ion 4823 mAh (Nano SIM) / 5088 mAh (eSIM only), 25W PD3.2, 25W wireless MagSafe/Qi2",
            "camera": "Triple 48 MP (wide, periscope telephoto, ultrawide) + TOF 3D LiDAR",
            "gpu": "Apple GPU (6-core graphics)",
            "batteryLife": "17h58 active use, 53h endurance"
        },
        "isActive": true,
        "createdAt": {
            "$date": "2026-04-23T20:52:00Z"
        },
        "updatedAt": {
            "$date": "2026-04-23T20:52:00Z"
        }
    },
    {
        "_id": {
            "$oid": "69e9f659bbe8a7c42df70306"
        },
        "categoryId": {
            "$oid": "69e9f54f9ef154d26c17ef1a"
        },
        "categorySlug": "smartphones",
        "name": "Apple iPhone 17 Pro",
        "slug": "apple-iphone-17-pro",
        "brand": "Apple",
        "model": "iPhone 17 Pro",
        "country": "International",
        "price": 22347.47,
        "promotionalPrice": 19925.41,
        "currency": "MDL",
        "stock": 150,
        "imageUrls": [
            "static/assets/images/prod-images/smartphones/apple/apple-iphone-17-pro-1.png"
        ],
        "specs": {
            "screenSize": "6.3 inches, 1206x2622 pixels, 120Hz",
            "processor": "Apple A19 Pro Hexa-core (2x4.26 GHz + 4x2.60 GHz)",
            "ram": "12 GB",
            "storage": "256GB / 512GB / 1TB NVMe",
            "os": "iOS 26 (upgradable to 26.4)",
            "battery": "Li-Ion 3998 mAh (Nano SIM) / 4252 mAh (eSIM only), 25W PD3.2, 25W wireless MagSafe/Qi2",
            "camera": "Triple 48 MP (wide, periscope telephoto, ultrawide) + TOF 3D LiDAR",
            "gpu": "Apple GPU (6-core graphics)",
            "batteryLife": "15h23 active use, 47h endurance"
        },
        "isActive": true,
        "createdAt": {
            "$date": "2026-04-23T20:56:00Z"
        },
        "updatedAt": {
            "$date": "2026-04-23T20:56:00Z"
        }
    },
    {
        "_id": {
            "$oid": "69e9f659bbe8a7c42df70307"
        },
        "categoryId": {
            "$oid": "69e9f54f9ef154d26c17ef1a"
        },
        "categorySlug": "smartphones",
        "name": "Apple iPhone Air",
        "slug": "apple-iphone-air",
        "brand": "Apple",
        "model": "iPhone Air",
        "country": "International",
        "price": 14936.76,
        "promotionalPrice": 13256.58,
        "currency": "MDL",
        "stock": 180,
        "imageUrls": [
            "static/assets/images/prod-images/smartphones/apple/apple-iphone-air-1.png"
        ],
        "specs": {
            "screenSize": "6.5 inches, 1260x2736 pixels, 120Hz, HDR10, Dolby Vision",
            "processor": "Apple A19 Pro Hexa-core (2x4.26 GHz + 4x2.60 GHz)",
            "ram": "12 GB",
            "storage": "256GB / 512GB / 1TB NVMe",
            "os": "iOS 26 (upgradable to 26.4)",
            "battery": "Li-Ion 3149 mAh, PD2.0 20W, wireless MagSafe/Qi2 (15W China), 4.5W reverse wired",
            "camera": "48 MP wide, OIS, 4K Dolby Vision HDR",
            "gpu": "Apple GPU (5-core graphics)",
            "batteryLife": "12h44 active use, 40h endurance"
        },
        "isActive": true,
        "createdAt": {
            "$date": "2026-04-23T20:58:00Z"
        },
        "updatedAt": {
            "$date": "2026-04-23T20:58:00Z"
        }
    },
    {
        "_id": {
            "$oid": "69e9f659bbe8a7c42df70308"
        },
        "categoryId": {
            "$oid": "69e9f54f9ef154d26c17ef1a"
        },
        "categorySlug": "smartphones",
        "name": "Apple iPhone 17",
        "slug": "apple-iphone-17",
        "brand": "Apple",
        "model": "iPhone 17",
        "country": "International",
        "price": 14938.99,
        "promotionalPrice": 14006.57,
        "currency": "MDL",
        "stock": 250,
        "imageUrls": [
            "static/assets/images/prod-images/smartphones/apple/apple-iphone-17-1.png"
        ],
        "specs": {
            "screenSize": "6.3 inches, 1206x2622 pixels, 120Hz, HDR10, Dolby Vision",
            "processor": "Apple A19 Hexa-core (2x4.26 GHz + 4x2.60 GHz)",
            "ram": "8 GB",
            "storage": "256GB / 512GB NVMe",
            "os": "iOS 26 (upgradable to 26.4)",
            "battery": "Li-Ion 3692 mAh, PD3.2 25W, wireless MagSafe/Qi2 (15W China), 4.5W reverse wired",
            "camera": "Dual 48 MP (wide + ultrawide), OIS, 4K Dolby Vision HDR",
            "gpu": "Apple GPU (5-core graphics)",
            "batteryLife": "14h59 active use, 41h endurance"
        },
        "isActive": true,
        "createdAt": {
            "$date": "2026-04-23T21:59:00Z"
        },
        "updatedAt": {
            "$date": "2026-04-23T21:59:00Z"
        }
    },
    {
        "_id": {
            "$oid": "69e9f659bbe8a7c42df70309"
        },
        "categoryId": {
            "$oid": "69e9f54f9ef154d26c17ef1a"
        },
        "categorySlug": "smartphones",
        "name": "Apple iPhone 16e",
        "slug": "apple-iphone-16e",
        "brand": "Apple",
        "model": "iPhone 16e",
        "country": "International",
        "price": 9121.5,
        "promotionalPrice": 7844.49,
        "currency": "MDL",
        "stock": 300,
        "imageUrls": [
            "static/assets/images/prod-images/smartphones/apple/apple-iphone-16e-1.png"
        ],
        "specs": {
            "screenSize": "6.1 inches, 1170x2532 pixels, HDR10",
            "processor": "Apple A18 Hexa-core (2x4.04 GHz + 4x2.20 GHz)",
            "ram": "8 GB",
            "storage": "128GB / 256GB / 512GB NVMe",
            "os": "iOS 18.3.1 (upgradable to 26.4)",
            "battery": "Li-Ion 4005 mAh, 50% in 30 min wired, 7.5W wireless Qi",
            "camera": "48 MP wide, OIS, 4K Dolby Vision HDR",
            "gpu": "Apple GPU (4-core graphics)",
            "batteryLife": "11h53 active use, 41h endurance"
        },
        "isActive": true,
        "createdAt": {
            "$date": "2026-04-23T23:00:00Z"
        },
        "updatedAt": {
            "$date": "2026-04-23T23:00:00Z"
        }
    },
    {
        "_id": {
            "$oid": "69e9f659bbe8a7c42df7030a"
        },
        "categoryId": {
            "$oid": "69e9f54f9ef154d26c17ef1a"
        },
        "categorySlug": "smartphones",
        "name": "Apple iPhone 16 Pro Max",
        "slug": "apple-iphone-16-pro-max",
        "brand": "Apple",
        "model": "iPhone 16 Pro Max",
        "country": "International",
        "price": 17026.8,
        "promotionalPrice": 14381.56,
        "currency": "MDL",
        "stock": 220,
        "imageUrls": [
            "static/assets/images/prod-images/smartphones/apple/apple-iphone-16-pro-max-1.png"
        ],
        "specs": {
            "screenSize": "6.9 inches, 1320x2868 pixels, 120Hz, HDR10, Dolby Vision",
            "processor": "Apple A18 Pro Hexa-core (2x4.05 GHz + 4x2.42 GHz)",
            "ram": "8 GB",
            "storage": "256GB / 512GB / 1TB NVMe",
            "os": "iOS 18 (upgradable to 26.4)",
            "battery": "Li-Ion 4685 mAh, PD2.0 25W, wireless MagSafe/Qi2 (15W China), 4.5W reverse wired",
            "camera": "Triple 48 MP (wide, periscope telephoto, ultrawide) + TOF 3D LiDAR",
            "gpu": "Apple GPU (6-core graphics)",
            "batteryLife": "17h18 active use, 48h endurance"
        },
        "isActive": true,
        "createdAt": {
            "$date": "2026-04-23T23:10:00Z"
        },
        "updatedAt": {
            "$date": "2026-04-23T23:10:00Z"
        }
    },
    {
        "_id": {
            "$oid": "69e9f659bbe8a7c42df7030b"
        },
        "categoryId": {
            "$oid": "69e9f54f9ef154d26c17ef1a"
        },
        "categorySlug": "smartphones",
        "name": "Apple iPhone 16 Pro",